{
  "implementation": "example-esra",
  "implementation_version": "0.1.0",
  "protocol_version": "1.2",
  "runtime": "example",
  "capabilities": {
    "cycle_review": {
      "status": "implemented",
      "evidence": ["skills/orchestrator/SKILL.md"]
    },
    "host_lifecycle_hook": {
      "status": "planned",
      "evidence": ["ROADMAP.md#host-integration"]
    }
  }
}
